smartctl 7.0 2018-12-30 r4883 [x86_64-linux-3.10.0-1160.81.1.el7.x86_64] (local build)
Copyright (C) 2002-18, Bruce Allen, Christian Franke, www.smartmontools.org

=== START OF INFORMATION SECTION ===
Model Family:     Toshiba 3.5" DT01ACA... Desktop HDD
Device Model:     TOSHIBA DT01ACA200
Serial Number:    X3HDZ2TGS
LU WWN Device Id: 5 000039 ff3e2146a
Firmware Version: MX4OABB0
User Capacity:    2,000,398,934,016 bytes [2.00 TB]
Sector Sizes:     512 bytes logical, 4096 bytes physical
Rotation Rate:    7200 rpm
Form Factor:      3.5 inches
Device is:        In smartctl database [for details use: -P show]
ATA Version is:   ATA8-ACS T13/1699-D revision 4
SATA Version is:  SATA 3.0, 6.0 Gb/s (current: 3.0 Gb/s)
Local Time is:    Wed Jan 11 09:13:34 2023 EST
SMART support is: Available - device has SMART capability.
SMART support is: Enabled

=== START OF READ SMART DATA SECTION ===
SMART overall-health self-assessment test result: PASSED

General SMART Values:
Offline data collection status:  (0x84) Offline data collection activity
                                        was suspended by an interrupting command from host.
                                        Auto Offline Data Collection: Enabled.
Self-test execution status:      (   0) The previous self-test routine completed
                                        without error or no self-test has ever 
                                        been run.
Total time to complete Offline 
data collection:                (14535) seconds.
Offline data collection
capabilities:                    (0x5b) SMART execute Offline immediate.
                                        Auto Offline data collection on/off support.
                                        Suspend Offline collection upon new
                                        command.
                                        Offline surface scan supported.
                                        Self-test supported.
                                        No Conveyance Self-test supported.
                                        Selective Self-test supported.
SMART capabilities:            (0x0003) Saves SMART data before entering
                                        power-saving mode.
                                        Supports SMART auto save timer.
Error logging capability:        (0x01) Error logging supported.
                                        General Purpose Logging supported.
Short self-test routine 
recommended polling time:        (   1) minutes.
Extended self-test routine
recommended polling time:        ( 243) minutes.
SCT capabilities:              (0x003d) SCT Status supported.
                                        SCT Error Recovery Control supported.
                                        SCT Feature Control supported.
                                        SCT Data Table supported.

SMART Attributes Data Structure revision number: 16
Vendor Specific SMART Attributes with Thresholds:
ID# ATTRIBUTE_NAME          FLAG     VALUE WORST THRESH TYPE      UPDATED  WHEN_FAILED RAW_VALUE
  1 Raw_Read_Error_Rate     0x000b   100   100   016    Pre-fail  Always       -       0
  2 Throughput_Performance  0x0005   140   140   054    Pre-fail  Offline      -       68
  3 Spin_Up_Time            0x0007   126   126   024    Pre-fail  Always       -       302 (Average 300)
  4 Start_Stop_Count        0x0012   100   100   000    Old_age   Always       -       61
  5 Reallocated_Sector_Ct   0x0033   100   100   005    Pre-fail  Always       -       1
  7 Seek_Error_Rate         0x000b   100   100   067    Pre-fail  Always       -       0
  8 Seek_Time_Performance   0x0005   124   124   020    Pre-fail  Offline      -       33
  9 Power_On_Hours          0x0012   089   089   000    Old_age   Always       -       77167
 10 Spin_Retry_Count        0x0013   100   100   060    Pre-fail  Always       -       0
 12 Power_Cycle_Count       0x0032   100   100   000    Old_age   Always       -       59
192 Power-Off_Retract_Count 0x0032   100   100   000    Old_age   Always       -       944
193 Load_Cycle_Count        0x0012   100   100   000    Old_age   Always       -       944
194 Temperature_Celsius     0x0002   253   253   000    Old_age   Always       -       15 (Min/Max 4/50)
196 Reallocated_Event_Count 0x0032   100   100   000    Old_age   Always       -       40
197 Current_Pending_Sector  0x0022   100   100   000    Old_age   Always       -       0
198 Offline_Uncorrectable   0x0008   100   100   000    Old_age   Offline      -       0
199 UDMA_CRC_Error_Count    0x000a   200   200   000    Old_age   Always       -       0

SMART Error Log Version: 1
ATA Error Count: 24 (device log contains only the most recent five errors)
        CR = Command Register [HEX]
        FR = Features Register [HEX]
        SC = Sector Count Register [HEX]
        SN = Sector Number Register [HEX]
        CL = Cylinder Low Register [HEX]
        CH = Cylinder High Register [HEX]
        DH = Device/Head Register [HEX]
        DC = Device Command Register [HEX]
        ER = Error register [HEX]
        ST = Status register [HEX]
Powered_Up_Time is measured from power on, and printed as
DDd+hh:mm:SS.sss where DD=days, hh=hours, mm=minutes,
SS=sec, and sss=millisec. It "wraps" after 49.710 days.

Error 24 occurred at disk power-on lifetime: 19140 hours (797 days + 12 hours)
  When the command that caused the error occurred, the device was active or idle.

  After command completion occurred, registers were:
  ER ST SC SN CL CH DH
  -- -- -- -- -- -- --
  40 51 08 9a f5 87 04  Error: UNC at LBA = 0x0487f59a = 76019098

  Commands leading to the command that caused the error were:
  CR FR SC SN CL CH DH DC   Powered_Up_Time  Command/Feature_Name
  -- -- -- -- -- -- -- --  ----------------  --------------------
  60 08 00 9a f5 87 40 00      00:17:06.871  READ FPDMA QUEUED
  27 00 00 00 00 00 e0 00      00:17:06.871  READ NATIVE MAX ADDRESS EXT [OBS-ACS-3]
  ec 00 00 00 00 00 a0 00      00:17:06.870  IDENTIFY DEVICE
  ef 03 42 00 00 00 a0 00      00:17:06.869  SET FEATURES [Set transfer mode]
  27 00 00 00 00 00 e0 00      00:17:06.869  READ NATIVE MAX ADDRESS EXT [OBS-ACS-3]

Error 23 occurred at disk power-on lifetime: 19140 hours (797 days + 12 hours)
  When the command that caused the error occurred, the device was active or idle.

  After command completion occurred, registers were:
  ER ST SC SN CL CH DH
  -- -- -- -- -- -- --
  40 51 08 9a f5 87 04  Error: UNC at LBA = 0x0487f59a = 76019098

  Commands leading to the command that caused the error were:
  CR FR SC SN CL CH DH DC   Powered_Up_Time  Command/Feature_Name
  -- -- -- -- -- -- -- --  ----------------  --------------------
  60 08 00 9a f5 87 40 00      00:17:06.390  READ FPDMA QUEUED
  27 00 00 00 00 00 e0 00      00:17:06.390  READ NATIVE MAX ADDRESS EXT [OBS-ACS-3]
  ec 00 00 00 00 00 a0 00      00:17:06.388  IDENTIFY DEVICE
  ef 03 42 00 00 00 a0 00      00:17:06.388  SET FEATURES [Set transfer mode]
  27 00 00 00 00 00 e0 00      00:17:06.388  READ NATIVE MAX ADDRESS EXT [OBS-ACS-3]

Error 22 occurred at disk power-on lifetime: 19140 hours (797 days + 12 hours)
  When the command that caused the error occurred, the device was active or idle.

  After command completion occurred, registers were:
  ER ST SC SN CL CH DH
  -- -- -- -- -- -- --
  40 51 08 9a f5 87 04  Error: UNC at LBA = 0x0487f59a = 76019098

  Commands leading to the command that caused the error were:
  CR FR SC SN CL CH DH DC   Powered_Up_Time  Command/Feature_Name
  -- -- -- -- -- -- -- --  ----------------  --------------------
  60 08 00 9a f5 87 40 00      00:17:05.957  READ FPDMA QUEUED
  27 00 00 00 00 00 e0 00      00:17:05.957  READ NATIVE MAX ADDRESS EXT [OBS-ACS-3]
  ec 00 00 00 00 00 a0 00      00:17:05.956  IDENTIFY DEVICE
  ef 03 42 00 00 00 a0 00      00:17:05.956  SET FEATURES [Set transfer mode]
  27 00 00 00 00 00 e0 00      00:17:05.956  READ NATIVE MAX ADDRESS EXT [OBS-ACS-3]

Error 21 occurred at disk power-on lifetime: 19140 hours (797 days + 12 hours)
  When the command that caused the error occurred, the device was active or idle.

  After command completion occurred, registers were:
  ER ST SC SN CL CH DH
  -- -- -- -- -- -- --
  40 51 08 9a f5 87 04  Error: UNC at LBA = 0x0487f59a = 76019098

  Commands leading to the command that caused the error were:
  CR FR SC SN CL CH DH DC   Powered_Up_Time  Command/Feature_Name
  -- -- -- -- -- -- -- --  ----------------  --------------------
  60 08 00 9a f5 87 40 00      00:17:05.484  READ FPDMA QUEUED
  27 00 00 00 00 00 e0 00      00:17:05.484  READ NATIVE MAX ADDRESS EXT [OBS-ACS-3]
  ec 00 00 00 00 00 a0 00      00:17:05.483  IDENTIFY DEVICE
  ef 03 42 00 00 00 a0 00      00:17:05.483  SET FEATURES [Set transfer mode]
  27 00 00 00 00 00 e0 00      00:17:05.483  READ NATIVE MAX ADDRESS EXT [OBS-ACS-3]

Error 20 occurred at disk power-on lifetime: 19140 hours (797 days + 12 hours)
  When the command that caused the error occurred, the device was active or idle.

  After command completion occurred, registers were:
  ER ST SC SN CL CH DH
  -- -- -- -- -- -- --
  40 51 08 9a f5 87 04  Error: UNC at LBA = 0x0487f59a = 76019098

  Commands leading to the command that caused the error were:
  CR FR SC SN CL CH DH DC   Powered_Up_Time  Command/Feature_Name
  -- -- -- -- -- -- -- --  ----------------  --------------------
  60 08 00 9a f5 87 40 00      00:17:05.011  READ FPDMA QUEUED
  27 00 00 00 00 00 e0 00      00:17:05.011  READ NATIVE MAX ADDRESS EXT [OBS-ACS-3]
  ec 00 00 00 00 00 a0 00      00:17:05.010  IDENTIFY DEVICE
  ef 03 42 00 00 00 a0 00      00:17:05.010  SET FEATURES [Set transfer mode]
  27 00 00 00 00 00 e0 00      00:17:05.010  READ NATIVE MAX ADDRESS EXT [OBS-ACS-3]

SMART Self-test log structure revision number 1
Num  Test_Description    Status                  Remaining  LifeTime(hours)  LBA_of_first_error
# 1  Extended offline    Completed without error       00%     11623         -
# 2  Short offline       Completed without error       00%     11619         -
# 3  Short offline       Completed without error       00%     11618         -
# 4  Short offline       Completed without error       00%     19140         -
# 5  Extended offline    Completed without error       00%     16350         -
# 6  Short offline       Completed without error       00%     16344         -

SMART Selective self-test log data structure revision number 1
 SPAN  MIN_LBA  MAX_LBA  CURRENT_TEST_STATUS
    1        0        0  Not_testing
    2        0        0  Not_testing
    3        0        0  Not_testing
    4        0        0  Not_testing
    5        0        0  Not_testing
Selective self-test flags (0x0):
  After scanning selected spans, do NOT read-scan remainder of disk.
If Selective self-test is pending on power-up, resume after 0 minute delay.
